{
  "schema_version": 1,
  "fixture_id": "reg-controlled-source-two-port-v1",
  "scenario": "controlled_source_case",
  "tolerance_profile": "rf_matrix_tight",
  "frequencies_hz": [
    1000.0,
    2500.0
  ],
  "ports": [
    "P1",
    "P2"
  ],
  "expected": {
    "y": [
      [
        [
          [
            0.15,
            -0.0
          ],
          [
            -0.04,
            0.0
          ]
        ],
        [
          [
            0.03,
            -0.0
          ],
          [
            0.12,
            -0.0
          ]
        ]
      ],
      [
        [
          [
            0.15,
            -0.0
          ],
          [
            -0.04,
            0.0
          ]
        ],
        [
          [
            0.03,
            -0.0
          ],
          [
            0.12,
            -0.0
          ]
        ]
      ]
    ],
    "z": [
      [
        [
          [
            6.25,
            0.0
          ],
          [
            2.0833333333333335,
            0.0
          ]
        ],
        [
          [
            -1.5625,
            0.0
          ],
          [
            7.8125,
            0.0
          ]
        ]
      ],
      [
        [
          [
            6.25,
            0.0
          ],
          [
            2.0833333333333335,
            0.0
          ]
        ],
        [
          [
            -1.5625,
            0.0
          ],
          [
            7.8125,
            0.0
          ]
        ]
      ]
    ],
    "s": [
      [
        [
          [
            -0.776,
            0.0
          ],
          [
            0.06400000000000002,
            0.0
          ]
        ],
        [
          [
            -0.048,
            0.0
          ],
          [
            -0.728,
            0.0
          ]
        ]
      ],
      [
        [
          [
            -0.776,
            0.0
          ],
          [
            0.06400000000000002,
            0.0
          ]
        ],
        [
          [
            -0.048,
            0.0
          ],
          [
            -0.728,
            0.0
          ]
        ]
      ]
    ],
    "status": {
      "y": [
        "pass",
        "pass"
      ],
      "z": [
        "pass",
        "pass"
      ],
      "s": [
        "pass",
        "pass"
      ]
    },
    "diagnostic_codes": {
      "y": [
        [],
        []
      ],
      "z": [
        [],
        []
      ],
      "s": [
        [],
        []
      ]
    }
  }
}
