{
  "schema_version": 1,
  "fixture_id": "reg-two-port-yzs-consistency-v1",
  "scenario": "two_port_yzs_consistency",
  "tolerance_profile": "rf_matrix_tight",
  "frequencies_hz": [
    1000.0,
    5000.0
  ],
  "ports": [
    "P1",
    "P2"
  ],
  "expected": {
    "y": [
      [
        [
          [
            0.02,
            6.283185307179586e-07
          ],
          [
            -0.004,
            0.0
          ]
        ],
        [
          [
            -0.004,
            0.0
          ],
          [
            0.03,
            3.141592653589793e-07
          ]
        ]
      ],
      [
        [
          [
            0.02,
            3.1415926535897933e-06
          ],
          [
            -0.004,
            0.0
          ]
        ],
        [
          [
            -0.004,
            0.0
          ],
          [
            0.03,
            1.5707963267948967e-06
          ]
        ]
      ]
    ],
    "z": [
      [
        [
          [
            51.3698629590725,
            -0.0016727846021854587
          ],
          [
            6.849315058122909,
            -0.0002947638065204641
          ]
        ],
        [
          [
            6.849315058122909,
            -0.0002947638065204641
          ],
          [
            34.24657533691593,
            -0.0003979311391662769
          ]
        ]
      ],
      [
        [
          [
            51.369861648045486,
            -0.008363922796671848
          ],
          [
            6.849314809237083,
            -0.0014738189910032961
          ]
        ],
        [
          [
            6.849314809237084,
            -0.0014738189910032964
          ],
          [
            34.24657520372015,
            -0.001989655683310733
          ]
        ]
      ]
    ],
    "s": [
      [
        [
          [
            0.008064515874333133,
            -1.6013418584988273e-05
          ],
          [
            0.0806451612587137,
            -1.7877819791149396e-06
          ]
        ],
        [
          [
            0.08064516125871371,
            -1.7877819791149403e-06
          ],
          [
            -0.19354838713203898,
            -5.210107483252449e-06
          ]
        ]
      ],
      [
        [
          [
            0.008064509761555193,
            -8.00670924385707e-05
          ],
          [
            0.08064516050010029,
            -8.938909832832506e-06
          ]
        ],
        [
          [
            0.0806451605001003,
            -8.938909832832504e-06
          ],
          [
            -0.19354838797839377,
            -2.6050537384653845e-05
          ]
        ]
      ]
    ],
    "s_from_y": [
      [
        [
          [
            0.008064515874333178,
            -1.6013418584988276e-05
          ],
          [
            0.08064516125871368,
            -1.7877819791149407e-06
          ]
        ],
        [
          [
            0.0806451612587137,
            -1.7877819791149407e-06
          ],
          [
            -0.193548387132039,
            -5.210107483252449e-06
          ]
        ]
      ],
      [
        [
          [
            0.008064509761555294,
            -8.00670924385707e-05
          ],
          [
            0.08064516050010027,
            -8.938909832832504e-06
          ]
        ],
        [
          [
            0.08064516050010029,
            -8.938909832832506e-06
          ],
          [
            -0.19354838797839374,
            -2.6050537384653845e-05
          ]
        ]
      ]
    ],
    "status": {
      "y": [
        "pass",
        "pass"
      ],
      "z": [
        "pass",
        "pass"
      ],
      "s": [
        "pass",
        "pass"
      ],
      "s_from_y": [
        "pass",
        "pass"
      ]
    },
    "diagnostic_codes": {
      "y": [
        [],
        []
      ],
      "z": [
        [],
        []
      ],
      "s": [
        [],
        []
      ],
      "s_from_y": [
        [],
        []
      ]
    }
  }
}
