{
  "schema_version": 1,
  "fixture_id": "reg-rc-rlc-one-port-v1",
  "scenario": "rc_rlc_sanity",
  "tolerance_profile": "rf_matrix_loose",
  "frequencies_hz": [
    1000.0,
    10000.0,
    100000.0
  ],
  "ports": [
    "P1"
  ],
  "expected": {
    "y": [
      [
        [
          [
            0.02,
            -0.15914865990658816
          ]
        ]
      ],
      [
        [
          [
            0.02,
            -0.015852662456117737
          ]
        ]
      ],
      [
        [
          [
            0.02,
            -0.0009632309002009949
          ]
        ]
      ]
    ],
    "z": [
      [
        [
          [
            0.7773542421472002,
            6.185744295521418
          ]
        ]
      ],
      [
        [
          [
            30.70748949021805,
            24.339773288160483
          ]
        ]
      ],
      [
        [
          [
            49.88429166856942,
            2.4025045584902553
          ]
        ]
      ]
    ],
    "s": [
      [
        [
          [
            -0.940582946541916,
            0.23640361083630568
          ]
        ]
      ],
      [
        [
          [
            -0.13574567566538934,
            0.342518301997917
          ]
        ]
      ],
      [
        [
          [
            -0.0005795475343256546,
            0.02406681655269493
          ]
        ]
      ]
    ],
    "status": {
      "y": [
        "pass",
        "pass",
        "pass"
      ],
      "z": [
        "pass",
        "pass",
        "pass"
      ],
      "s": [
        "pass",
        "pass",
        "pass"
      ]
    },
    "diagnostic_codes": {
      "y": [
        [],
        [],
        []
      ],
      "z": [
        [],
        [],
        []
      ],
      "s": [
        [],
        [],
        []
      ]
    }
  }
}
